{
  "$schema": "../schema/benchmark-metadata.schema.json",
  "registry_version": "0.1.0",
  "last_updated": "2026-08-25",
  "star_snapshot_as_of": "2026-08-25",
  "policy": {
    "launch": "Earliest verified public paper, benchmark release, dataset publication, project launch, or repository publication. Precision is explicit; a month or year is not an exact day.",
    "stars": "GitHub stargazers_count for the official benchmark repository, toolkit, or declared shared host suite. Null means no official repository or an unavailable repository, not zero stars."
  },
  "benchmarks": [
    {
      "id": "simpletes",
      "name": "SimpleTES",
      "launch": {
        "value": "2026-04",
        "precision": "month",
        "basis": "paper",
        "source": "https://arxiv.org/abs/2604.19341"
      },
      "github": {
        "repository": "wq-will/SimpleTES",
        "repository_scope": "benchmark-specific",
        "stars": 169,
        "stars_as_of": "2026-08-25",
        "status": "available"
      }
    },
    {
      "id": "mle-bench",
      "name": "MLE-bench",
      "launch": {
        "value": "2024-10",
        "precision": "month",
        "basis": "paper",
        "source": "https://arxiv.org/abs/2410.07095"
      },
      "github": {
        "repository": "openai/mle-bench",
        "repository_scope": "benchmark-specific",
        "stars": 1716,
        "stars_as_of": "2026-08-25",
        "status": "available"
      }
    },
    {
      "id": "naturebench",
      "name": "NatureBench",
      "launch": {
        "value": "2026-06",
        "precision": "month",
        "basis": "paper",
        "source": "https://arxiv.org/abs/2606.24530"
      },
      "github": {
        "repository": "FrontisAI/NatureBench",
        "repository_scope": "benchmark-specific",
        "stars": 102,
        "stars_as_of": "2026-08-25",
        "status": "available"
      }
    },
    {
      "id": "posttrainbench",
      "name": "PostTrainBench",
      "launch": {
        "value": "2026-03",
        "precision": "month",
        "basis": "paper",
        "source": "https://arxiv.org/abs/2603.08640"
      },
      "github": {
        "repository": "aisa-group/PostTrainBench",
        "repository_scope": "benchmark-specific",
        "stars": 532,
        "stars_as_of": "2026-08-25",
        "status": "available"
      }
    },
    {
      "id": "arc-agi-3",
      "name": "ARC-AGI-3",
      "launch": {
        "value": "2026-04-22",
        "precision": "day",
        "basis": "official-release",
        "source": "https://arcprize.org/arc-agi/3"
      },
      "github": {
        "repository": "arcprize/ARC-AGI",
        "repository_scope": "toolkit",
        "stars": 69,
        "stars_as_of": "2026-08-25",
        "status": "available"
      }
    },
    {
      "id": "dig-bench",
      "name": "DiG-bench",
      "launch": {
        "value": "2026-08-12",
        "precision": "day",
        "basis": "paper",
        "source": "https://arxiv.org/abs/2608.12593"
      },
      "github": {
        "repository": "discos-research/dig-bench",
        "repository_scope": "benchmark-specific",
        "stars": 24,
        "stars_as_of": "2026-08-25",
        "status": "available"
      }
    },
    {
      "id": "edgebench",
      "name": "EdgeBench",
      "launch": {
        "value": "2026-07-02",
        "precision": "day",
        "basis": "official-release",
        "source": "https://edge-bench.org/"
      },
      "github": {
        "repository": "ByteDance-Seed/EdgeBench",
        "repository_scope": "benchmark-specific",
        "stars": 432,
        "stars_as_of": "2026-08-25",
        "status": "available"
      }
    },
    {
      "id": "rsi-bench-live",
      "name": "RSI Bench",
      "launch": {
        "value": "2026-08-07",
        "precision": "day",
        "basis": "project-launch",
        "source": "https://www.rsi-benchmark.com/"
      },
      "github": {
        "repository": null,
        "repository_scope": "none",
        "stars": null,
        "stars_as_of": null,
        "status": "no-official-repository"
      }
    },
    {
      "id": "rsibench",
      "name": "RSIBench",
      "launch": {
        "value": "2026",
        "precision": "year",
        "basis": "dataset-publication",
        "source": "https://huggingface.co/datasets/AgPerry/rsi-bench"
      },
      "github": {
        "repository": "reacher-z/rsi-bench",
        "repository_scope": "benchmark-specific",
        "stars": null,
        "stars_as_of": null,
        "status": "repository-unavailable"
      }
    },
    {
      "id": "ai4ai-bench",
      "name": "AI4AI-Bench",
      "launch": {
        "value": "2026-08-20",
        "precision": "day",
        "basis": "paper",
        "source": "https://arxiv.org/abs/2608.20318"
      },
      "github": {
        "repository": null,
        "repository_scope": "none",
        "stars": null,
        "stars_as_of": null,
        "status": "no-official-repository"
      }
    },
    {
      "id": "re-bench",
      "name": "RE-Bench",
      "launch": {
        "value": "2024-11",
        "precision": "month",
        "basis": "paper",
        "source": "https://arxiv.org/abs/2411.15114"
      },
      "github": {
        "repository": "METR/RE-Bench",
        "repository_scope": "benchmark-specific",
        "stars": 156,
        "stars_as_of": "2026-08-25",
        "status": "available"
      }
    },
    {
      "id": "mlr-bench",
      "name": "MLR-Bench",
      "launch": {
        "value": "2025",
        "precision": "year",
        "basis": "paper",
        "source": "https://proceedings.neurips.cc/paper_files/paper/2025/hash/ab8dd000d6f87f40061a73f8bca7fae4-Abstract-Datasets_and_Benchmarks_Track.html"
      },
      "github": {
        "repository": null,
        "repository_scope": "none",
        "stars": null,
        "stars_as_of": null,
        "status": "no-official-repository"
      }
    },
    {
      "id": "paperbench",
      "name": "PaperBench",
      "launch": {
        "value": "2025-04",
        "precision": "month",
        "basis": "paper",
        "source": "https://arxiv.org/abs/2504.01848"
      },
      "github": {
        "repository": null,
        "repository_scope": "none",
        "stars": null,
        "stars_as_of": null,
        "status": "no-official-repository"
      }
    },
    {
      "id": "inferencebench",
      "name": "InferenceBench",
      "launch": {
        "value": "2026-04",
        "precision": "month",
        "basis": "repository-publication",
        "source": "https://github.com/aisa-group/InferenceBench"
      },
      "github": {
        "repository": "aisa-group/InferenceBench",
        "repository_scope": "benchmark-specific",
        "stars": 42,
        "stars_as_of": "2026-08-25",
        "status": "available"
      }
    },
    {
      "id": "agenthpobench",
      "name": "AgentHPOBench",
      "launch": {
        "value": "2026-07",
        "precision": "month",
        "basis": "paper",
        "source": "https://arxiv.org/abs/2607.29626"
      },
      "github": {
        "repository": null,
        "repository_scope": "none",
        "stars": null,
        "stars_as_of": null,
        "status": "no-official-repository"
      }
    },
    {
      "id": "sciagentarena",
      "name": "SciAgentArena",
      "launch": {
        "value": "2026-06",
        "precision": "month",
        "basis": "paper",
        "source": "https://arxiv.org/abs/2606.12736"
      },
      "github": {
        "repository": null,
        "repository_scope": "none",
        "stars": null,
        "stars_as_of": null,
        "status": "no-official-repository"
      }
    },
    {
      "id": "earthverse",
      "name": "EarthVerse",
      "launch": {
        "value": "2026-08-24",
        "precision": "day",
        "basis": "paper",
        "source": "https://arxiv.org/abs/2608.23525"
      },
      "github": {
        "repository": null,
        "repository_scope": "none",
        "stars": null,
        "stars_as_of": null,
        "status": "no-official-repository"
      }
    },
    {
      "id": "scienceagentbench",
      "name": "ScienceAgentBench",
      "launch": {
        "value": "2024-10",
        "precision": "month",
        "basis": "paper",
        "source": "https://arxiv.org/abs/2410.05080"
      },
      "github": {
        "repository": "OSU-NLP-Group/ScienceAgentBench",
        "repository_scope": "benchmark-specific",
        "stars": 161,
        "stars_as_of": "2026-08-25",
        "status": "available"
      }
    },
    {
      "id": "exp-bench",
      "name": "EXP-Bench",
      "launch": {
        "value": "2025-05",
        "precision": "month",
        "basis": "paper",
        "source": "https://arxiv.org/abs/2505.24785"
      },
      "github": {
        "repository": "EvolvingLMMs-Lab/EXP-Bench",
        "repository_scope": "benchmark-specific",
        "stars": null,
        "stars_as_of": null,
        "status": "repository-unavailable"
      }
    },
    {
      "id": "swe-bench-verified",
      "name": "SWE-bench Verified",
      "launch": {
        "value": "2024-06",
        "precision": "month",
        "basis": "official-release",
        "source": "https://openai.com/index/introducing-swe-bench-verified/"
      },
      "github": {
        "repository": "SWE-bench/SWE-bench",
        "repository_scope": "shared-suite",
        "stars": 5708,
        "stars_as_of": "2026-08-25",
        "status": "available"
      }
    },
    {
      "id": "swe-bench-pro",
      "name": "SWE-bench Pro",
      "launch": {
        "value": "2025",
        "precision": "year",
        "basis": "project-launch",
        "source": "https://scale.com/leaderboard/swe_bench_pro_public"
      },
      "github": {
        "repository": null,
        "repository_scope": "none",
        "stars": null,
        "stars_as_of": null,
        "status": "no-official-repository"
      }
    },
    {
      "id": "multi-swe-bench",